{
  "schema_version": "1.0.0",
  "suite_id": "personal-selection-v1",
  "revision": "1",
  "temperature": 0,
  "streaming": true,
  "workloads": [
    {
      "workload_id": "short-instruction",
      "prompt": "In two sentences, explain why a personal local-model choice should prefer wall-clock time and reliability over lab-grade metric purity.",
      "max_tokens": 128,
      "response_contract": "text"
    },
    {
      "workload_id": "strict-tool-json",
      "prompt": "Return exactly this JSON object with no markdown or extra text: {\"name\":\"status\",\"arguments\":{\"run_id\":\"stage1-test\",\"include_details\":false}}",
      "max_tokens": 512,
      "response_contract": "status-tool-json"
    },
    {
      "workload_id": "wiki-constraint-summary",
      "prompt": "Read this policy: repository files define executable truth; durable notes explain intent and history; generated evidence requires review before becoming policy. Summarize the precedence in three short bullets and do not invent new rules.",
      "max_tokens": 256,
      "response_contract": "text"
    }
  ]
}
