{
  "schema_version": "1.0.0",
  "suite_id": "omlx-thinking-smoke-v1",
  "revision": "1",
  "temperature": 0,
  "streaming": true,
  "workloads": [
    {
      "workload_id": "thinking-short-reason",
      "prompt": "Think through the steps briefly, then answer in one sentence: why does a thinking-aware token budget matter for measurement?",
      "max_tokens": 512,
      "response_contract": "text"
    },
    {
      "workload_id": "thinking-plan-and-answer",
      "prompt": "Plan your reasoning, then give a two-sentence answer: what is the difference between transport failure and an empty visible answer in a thinking-model smoke test?",
      "max_tokens": 768,
      "response_contract": "text"
    }
  ]
}
